essays_id,essay_set,essay,rater1_domain1,rater2_domain1,domain1_score,word_count,reading_ease,nouns,verb,adjectives,adverbs,jaccard
9462,4,The author concludes story paragraph many reasons The author wanted convey sense hope show growth character show thing going change In last paragraph vows take test gives sense everything okay Earlier story crying missing homeland tone troubled sad This last paragraph suggests tone hopeful Even though failed test still going try The author also put paragraph show much character grow Saying try shows much stronger determed lastly story end paragraph foreshadow come The geese coming back snow melting hibiscus budding show change seasons This represents change occurred foreshadows things different,3,3,3,90,75,39,23,12,8,0.32
9463,4,The author concluded story message If think seems whole story leavs opening requal It ovious whole point story make think,1,1,1,20,75,8,4,5,0,0.28
9464,4,I think author add paragraph sign new start Because hard time main alway hard times,0,0,0,15,85,5,3,4,1,0.26
9465,4,The author concludes story paragraph It meant lot Saeng Saeng failed driving test scared tell mother also spent nineteen dollars Dok Faeng noi flower plant back home For example As Saeng walks home failing driver test sees familiar plant The plant Saeng saw meant lot mother PERSON uttered small cry surprise delight Dok faeng said get That quote stating mother excited hear The story concluded paragraph saeng went mother glad bought It beautiful plant dok faeng noi finally said I glad got,1,1,1,82,60,41,17,8,7,0.44
9466,4,Authors sometimes use intisting sentences concludy sentence MONTH hard time understding In story Winter Hibiscus The author concludes story saying come back Saeng vowed siletly iN sprng snows melt gesse return hibiscus budding I take test The author says show Saeng ready gardam yet needs lean The mother verry disapointed daghter buying plant expensve shows inexperience buying thigs fodings wrong This showed wha say I paid Nineteen dollars You She also says CAPS facing Na gott showing suprise expensve beutiful plant Authes use paragraphs sentences show recap story The Author winter hibiscus CAPS story paragraph Saeng shuld Not hav boght plant bascal hav emotions shall try agan Next year mess,1,1,1,110,70,52,24,14,7,0.39
9467,4,The author passage ends story statements creates curiosity Thi creates curiosity writing spring geese return Spring beginning many creatures earth therefore Saeng trying start must wait spring The hibiscus reinforces feeling new beginningin year new bad grow like second chance Saeng waits spring knows every thing else creates new life Saeng must wait till get new beginning,2,2,2,57,45,24,16,9,2,0.33
9468,4,I think reason author ended story paragraph time thinks ready retake driver test Before made move dishearted failed test Maybe picked spring time gives time get together practice spring time,1,1,1,30,70,13,9,5,2,0.33
9469,4,The author includes scentence When come back Saeng vowed silently spring snows melt geese return hibiscus budding I take test show determination She determined pass test Even facing problems adapting LOCATION wents sucseed So wait year try better prepared,1,1,1,39,75,17,11,3,5,0.39
9470,4,From story girl moved Vietnam United ORGANIZATION It hard girl understand anything anything bring memory back Vietnam The author concludes story paragraph fail test see wants see hibiscus budding I I failed test Saeng said mother Her mother actually understand happen let Saeng keep hibiscus make Saeng feel better Saeng miss Vietnam lot like try best overcome obstacles,2,2,2,58,65,27,11,10,4,0.47
9471,4,The author concludes paragraph wants make clearer readers would understand It And could make better stand,0,0,0,16,80,5,5,1,0,0.38
9472,4,The author finished story paragraph paragraph saying overtime adapted well every thing able take test says geese return hibiscus budding CAPS needs time Time get warm time grow Also paragraph well thought relates entire story So concluded great paragraph made lot sense relationship story,1,1,1,44,70,21,10,5,6,0.39
9473,4,In story Winter Hibiscus Minfong Ho Ho concludes story paragraph due fact flower represents hapiness home The flower symbolizes past comfort Saeng began dig winter hibiscus In could hear sounds cooking kitchen All Saeng sense beginning return happy likewise author uses geese explain comfort Saeng The country around began feel like home She became familiar surroundings Many references home made throughout piece home place comfort happiness therefore Saeng would gain confidence explans reason CAPS Ho concluded sentence,3,2,3,77,60,39,15,10,1,0.34
9474,4,I think author concludes story paragraph When come back Saeng vowed silently iN spring wheN CAPS melt geese RetuRN hibiscus budding I take test means author kinda like meaning life That mess okay try better,1,1,1,35,70,17,9,1,2,0.37
9475,4,She concludes paragraph story realy wants people realize always fun Also love Shes making world loves wathing flower geese return hibiscus budding show favorite thing loves flowers,0,0,0,27,75,10,9,4,3,0.35
9476,4,The author concludes story way go important things story I take test This test failed day The test failed tested memory home Her old country important The part quote come back show geese return referring says She realized many things thought strange become almost familiar Like geese She saying everything country starting get used like geese fly south every winter When uses hibiscus budding saying remember things forgotten moved country When got hibiscus reached touched petal gently It felt smooth cool hint velvet toward center known would feel This whole statement basically saying starting forget things country country becomes familiar geese return meaning DATE remember take test knowledge pass,1,2,2,109,60,37,32,18,6,0.41
9477,4,The author concludes story paragraph trying put across message plant shows symbol new beginings symbol saeng vowe Also story caring plant teaches saeng responsablity obtaining license care plant teach patients needs learn mistakes made,1,1,1,34,50,20,9,2,1,0.37
9478,4,The author ends story paragraph shows willing give new life I I failed test Saeng failed drivers test unhappy She also disliked new home She still shaky say home missed old home really wanted give After talking mother renewed hopes author uses paragraph signify still hope end ready try When snows melt geese return hibiscus budding I take test,2,1,2,59,65,21,21,8,4,0.29
9479,4,The author concludes story show tone The paragraph shows Saeng determined try pass This teaches lesson reader Lessons try hardestand give The last paragraph ends story sence curiosity It makes want passes,1,1,1,32,85,14,9,4,0,0.33
9480,4,I think concluding paragraph means everything else important meant happen happens take test basically last thing happen I think pass meant happen,1,1,1,22,30,9,7,4,2,0.32
9481,4,I belive saeng made silent vow plant goes though hard winter everything goes back likes plant starts budding kind represents hardtime moving plant loves much make,1,1,1,26,40,9,10,4,3,0.29
9482,4,The author Winter Hibiscus concludes story excerpt come back Saeng vowed silently spring snows melt geese return hibiscus budding I take test emphasizes Saeng pain come unknown place fail first test also emphasizes Saeng resolve work hard seeing flower resembled one home The flower important Saeng example text reads And besides yet another old friend small shrub waxy leaves dainty flowers purplish petals white centers This excerpt demonstrates Saeng love hometown flower knows grows back home Another example Saeng told mother bad news I I failed test CAPS attention instantly drawn flower mother could good In conclusion hibiscus flower Saeng source stength thing knows united states Saeng wants show resolve test flower shows harsh winter,2,2,2,115,55,52,28,18,8,0.34
9483,4,The author concludes story afore mentioned paragraph represent connection return hibiscus bids return Saeng resolve In photograph question NUM hibiscus flower place belong similar Saeng The hibiscus represented link Saeng past portrayed author writes Plants even realized known forgotten drew back childhood world The hibiscus native homeland helping Saeng remember past began cope present later future come back Saeng vowed silently spring snows melt geese return hibiscus budding I take test,2,2,2,71,40,29,17,13,6,0.42
9484,4,By quote author explaining Saeng eventually ready test When geese return ready return From migration hibiscus budding ready turn beautiful flower Saeng believes spring since flower geese ready ready,2,1,2,29,75,10,4,10,1,0.29
9485,4,The author concludes paragraph narrarator willing accept adapt new environment like flower flower would Geese like warm cold flying south winter Saeng comfort tone LOCATION many childhood memories including grandmother hibiscus flower She used flower warm environment So geese come back spring flower blossoms ready adapt CAPS life take drivers test The geese hibiscus flower symbolic memory old home LOCATION misses much After things come try adapt CAPS ways life,3,2,3,70,65,33,10,16,3,0.43
9486,4,Saeng would return homeland,0,0,0,4,90,2,1,0,0,0.46
9487,4,In passage winter hibiscus author uses phrase last paragraph came back Saeng vowes silently spring snow melt geese return hibiscus budding I take test I believe concluded story words change saying means birds flewaway Even bird seasons would back like always An example says birds eased hibiscus Mingled last paragraph thinking would stay next season keys likes This I get last paragraph story winter hibiscus means,2,1,2,66,70,30,17,8,5,0.33
9488,4,The author concludes story paragraph author showing becomes spring geese budding said silently self going take permit,0,0,0,17,45,7,7,1,1,0.29
9489,4,The author concludes story paragraph wants show saeng determination survive happy new home Although happy purchase trying make seem homey When says take test shows wants surroundings comfortable By ending paragraph also shows strongness seasons As saeng start try life She content moment planning please mother spring This paragraph also serves promise discover new way live make friends The plant like symbol going change going investigate pass test proving diserves happy make feel home,2,2,2,74,75,29,20,13,3,0.34
9490,4,The author concluded paragraph story showing geese hang around garden around spring time,0,0,0,13,70,6,2,2,0,0.27
9491,4,The author story explaynes hard changes The author also explayns family object frome home flower comforting The meaning story show one author expierances life,1,1,1,24,70,12,6,1,1,0.25
9492,4,I think author concludes party wanted let reader know little girl going give planting flower spring come snow melt going plant flower see spring even though work well winter season let stop I think author trying say something work keep trying maybe something different happen,0,0,0,45,0,18,16,6,4,0.25
9493,4,In story Winter Hibiscus author concludes story When come back take test She show still hope give She went lot moved seemed sense depression story sadness within story finally gets energy back tell keep trying CAPS I take test shows hope And warm moist shelter greenhouse Saeng broke wept She obviously upset plant reminds home conclusion I thought wise choice end passage positive addittude,2,2,2,64,30,29,15,7,5,0.33
9494,4,I think author ends story paragraph many reasons One reason It leaves knowing Saeng never give tring Another reason something simple flower encourage someone keep going even nothing go Saeng says flower something important working harder encourage keep best The author leaves sentence powerful brings Saeng courage,2,1,2,47,70,19,14,6,3,0.34
9495,4,The author concludes story failed test already wanted pass nexttime So make mother dissapointed,1,1,1,14,50,6,5,0,2,0.29
9496,4,I think narrator means saying wants come back everything beautifle She wants WAIT FOR ALL OF THE SNOW TO MELT AND GEESE TO RETURN SO SHE CAN SEE ALL THE COLORS OF THE FLOURS AND IF SHE PASSES HER TEST THIS TIME SHE WILL GET TO DRIVE PAST ALL THE FLOURS THATS WHAT I THINK THE CHARECTER MEANS iN THiS STORY,0,0,0,61,80,14,15,1,1,0.57
9497,4,The author story ends story paragraph explains Saeng give hibiscus Earlier story explains winter hibiscus die In paragraph says snows melt means seasons keep going Saeng keep going trying Also author says geese return means geese keep coming back Saeng keep trying take test,2,2,2,44,70,16,16,7,3,0.34
9498,4,I belive author used lines last paragraph When come back Saeng vowed silently snows melt geese return hibiscus budding I take test CAPS realy liked,0,0,0,25,55,10,9,3,2,0.34
9499,4,I think author concludes paragraphs show meaning story The author could wanted show details story,0,0,0,15,60,8,5,0,0,0.26
9500,4,The author concludes story paragraph wants show start retaking test hibiscus start budding new flowers Saeng shows us try overcome obstacles must face like hibiscus flower geese overcome winter In story author makes hibiscus represent way adjust changes life In way winter hibiscus represents Saeng flower adapting circumstances circumstance winter Just like hibiscus flower Saeng must overcome obstacles new country retaking drivers exam,2,2,2,63,60,28,17,8,2,0.31
9501,4,When come back Saeng vowed silently spring snows melt geese return hibiscus budding I take test paragraph author uses conclude story In opinion author includes paragraph conclude story order show Saeng committed adjusting new home leaving old one For example story Saeng unable say I mean like kind home without bursting tears This illustrates sorrow inability let go past,1,2,2,59,65,25,17,7,2,0.31
9502,4,The author could finished story paragraph many reasons He probably finished paragraph show Saeng cared adapting new place failure quiter The author also probably finished story way show Saeng determined success make mother happy This author finished story paragraph,1,1,1,39,70,18,9,3,4,0.35
9503,4,The author concludes story paragraph Saeng given small glimmer hope winter hibiscus The hibiscus reminds homeland Vietnam pleases Also fact hibiscus purchases survive winter unlike hibiscus homeland symbolizes Saeng determination adapt new country The future hibiscus symbolizes Saeng survival adaptation new country include retaking driving test,2,2,2,46,50,21,12,7,1,0.39
9504,4,The author concludes story statement many reasons First Hibiscus strong wind stops blowing therefore Saeng strong Also Saeng giving time adjust get used new surroundings She setting real goal Saeng identifieng flower It gives comfort brings back valuable memories things loved things made happy like home country grandmother,1,2,2,48,80,20,12,8,4,0.38
9505,4,The author story concludes paragraph show Saeng determination I say hibiscus story sees plant joyed see happy reminders grandmother hair tries She snow test She want see could try past When home said I failed test This snows melt want move easy hope So hibiscus shows life paragraph shows Saeng trying move different English seal,1,2,2,55,55,25,14,8,0,0.29
9506,4,In story I believe Saeng sad misses home hibiscus flower She ends story well since peace waiting take test I believe ended story like leave worried angry She turn negative attitude positive one says retake test geese return hibiscus budding,2,1,2,40,75,15,13,5,1,0.28
9507,4,The author concludes sentence shows Saeng going try adapt new home He lets know Saeng gon na grieve sad anymore adapt continue life The author adds I mean like kind NUM This Saeng come home talked mother sad thought old memories old home adding last statement story shows Saeng decided move life longer sad She set goal accept This reason author conclude story like,2,2,2,64,80,23,17,11,3,0.36
9508,4,Many authors end storys different ways But Minfong Ho ended almost saying One reason ended story way kinda revealed would happen Saeng future Like end says I take test This lets reader know author might write another story Saeng takes test A second example showing Saeng strong beautiful try This show author said snow melts geese return hibiscus budding see said hibiscus referring Saeng Without writings techniques hints might know sequal might happen,2,2,2,73,70,25,20,14,2,0.38
9509,4,They author must put story show change For giving things give e replemise author People dont think small damages nuste comrade big changes The small ones count turnig sioteero I bind On top old anges drive We go harsh big small need come,0,0,0,43,100,17,11,9,0,0.34
9510,4,This important paragraph narrator put story For instance Saeng saying new home flowers important school test And saeng many friends go see school hibiscus remind old friends made Saeng simply stating everything back normal way wants take test In conclusion narrator used paragraph let us know saeng feels,1,1,1,48,75,22,12,7,2,0.34
9511,4,The author concludes story paragraph concludes wraps story It shows relationship nature adapting calmed failing test,1,1,1,16,70,7,5,2,0,0.19
9512,4,The author concludes story sentence like end winter spring snow melt trees flowers blosom different colored flowers After flowers blosomed leaves come pollin found right kind trees At end DATE fall leaves start die change color leaves fall Then snows,0,0,0,40,80,21,9,4,2,0.38
9513,4,The author concludes story paragraph When come back Saeng vowed silently spring When snows melt ant geese return hibiscus budding I take test shows That Saeng going stay It shows That The hibiscus overcome winter like Saeng mother says strong enough make Through cold months This winter hibiscus That matters This symbolizes Saeng overcoming failing The driver test also moving LOCATION She The back home strong enough get Through This change life Also taking The test spring symbolizes starting everyThing new overcome winter This ending paragraph important shows Saeng promise That get past The challenges front CAPS come When Saeng says When snows melt symbolizes The time life failures become good She take The test new look life The author concludes The story This paragraph shows That Saeng going stay,3,3,3,130,65,46,35,11,7,0.41
9514,4,The author concludes story paragraph Where Saeng vowed silently spring snows melt geese return hibiscun budding I take test Minpong Ho failed test Saeng failed fine fine toothed comb hibiscus hedge well gentle grandmother Apperantly things could found snows melt geese reture hibiscus budding,1,1,1,44,75,21,11,5,4,0.33
9515,4,The author concludes story paragraph show Saeng outlook future It fitting conclusion drawing numerous elements story shows Saeng grown Saeng refers When snows melt geese return hibiscus budding In phrase shows growing acceptance even affection new homeland The geese familiar Saeng despite thinking strange The hibiscus piece past adapted fit current situation Saeng vow take test spring When snows melt etc This shows despite losing much home grandmother way life Saeng still determined make best situation She plans passing driving test come spring matter The concluding paragraph fitting way wrap story It thrends Saeng past present entwined displays attitude towards future With optimistic words final paragraph nearly ties mood optimism amidst regret The author wording well done,3,3,3,117,65,50,28,16,5,0.27
9516,4,The author concludes story paragraph story says I take test So trying say much adjusted changes life In story also states come back That concludes flower come back next season She much reminber homeland grandma good things,1,1,1,37,85,13,10,5,5,0.27
9517,4,The reason author concludes story paragraph wanted reader know another story made Also show Saeng happy snow melted geese return hibiscus budding,1,1,1,22,60,9,7,3,1,0.37
9518,4,Now knows lot plants narrator makes seem like girl interested CAPS R CAPS The new world different plants bloom look beautiful season way I see girl really enjoys plants characteristic I say adventurous girl likes explore new worlds see explained,0,0,0,40,55,14,12,10,2,0.39
9519,4,The author concludes story paragraph shows Saeng come weaknesses succeed newhome What CAPS In spring snows melt geese return hibiscus budding I take test It means try CAPS Test try new test make like wheres CAPS,1,1,1,36,65,14,12,5,1,0.34
9520,4,The author concludes story paragraph many reasons The first reason show Saeng determined young girl By vowing take test shows determined giving Another reason author wanted ampasize importance idea Saeng personality,1,1,1,31,65,15,7,4,1,0.38
9521,4,Minfong Ho concluded story shows Saeng determination pass drivers test The fact failed made feel bad brought feelings homesickness familiar plant final paragraph vows overcome challenges unfimiliar place pull together accomplish goal winter hibiscus,2,2,2,34,40,18,7,5,3,0.38
9522,4,The author included sentence paragraph Saeng determined girl She would keep trying till got right No matter long hard would would get done Just like picture Hibiscus flower next highway It certainly woked place would anything survive Being strong times depend hard Saeng determined loss perfection Hibiscus flower,2,2,2,48,80,17,12,6,4,0.35
9523,4,In concluding statement Saeng states come back In spring snows melt geese return hibiscus budding I take test The author concludes story passage using hibiscus example survival The hibiscus isfrom another place like using represent well new place In way saying If hibiscus survives winter I I believe uses conclusion depict unsure nature towards new home,2,3,3,56,60,24,15,5,2,0.27
9524,4,I believe author uses last paragraph tells Saeng wants overcome strong even though She misses home For example Saeng believed since cried saw hibibiscus plant failed believes get stronger time,1,1,1,30,75,12,10,3,1,0.28
9525,4,The author concludes story specific paragraph sum realization determination Saeng obtains First Saeng starts upset failing test When sees flower goes find shop overwhelmed small reminder old home That small flower made realize much missed old home buying becomes nessesity She probably felt flower would always little piece home newer world After realizing memories whats important seeing flower determination survive cold winter develops determination take test She vows gained faith flower survival realization important memories All ending paragraph reveals specific messages,3,3,3,81,60,31,19,19,3,0.36
9526,4,The reason author inspired flower The flower ability survive harsh winters adapt new environments She decides going comes obstacles flower comes obstacles every winter,2,1,2,24,60,9,7,3,1,0.31
9527,4,Memory promise life ideas explain author concludes story paragraph Memories one idea helps explain author concludes story paragraph saeng misses old life country Promise another idea saeng makes vow spring comes take test Life another idea saeng brought flower planted soit live spring come said n retake test Memories promise life help explain author conclude story paragraph Memories come back spring along promises made wants start saeng pla nting hibiscus brings back lot memories life,2,2,2,75,40,40,19,9,3,0.32
9528,4,The author concludes story statement gotten colder plants flowers going die,0,0,0,11,65,7,2,1,0,0.23
9529,4,Resons I think author concludes saying top I think concludes becus vary eger passing test She told self vowed take test geese return snow melsts Another reson I think author concludes becus faled first time big thing vary eger passing That I think author added story,1,1,1,46,85,19,15,8,0,0.34
9530,4,In story Winter Hibiscus Saeng failed drivers test walking home spies flower reminds home She buys flower returns new home mother working garden They decide plant flower garden flower planted flock geese fly head Saeng realizes everything familier everything quite strange She concludes story saying geese come back spring take test She says flower buckling means blooming growing grown familiar everything ready test geese ready come home hibiscus ready bloom,2,2,2,70,65,33,19,11,2,0.33
9531,4,The author comparing plant The author plant starts bloom character confidence come back The author concludes story paragraph gives story meaning,1,1,1,21,70,13,4,0,1,0.34
9532,4,The Author concludes story With CAPS paragraph emphasize story make seem interesting make reader want story keep going find happens next,1,1,1,21,50,8,7,2,0,0.31
9533,4,I think Author put last paragraph story show everyone determined pass test much means I think Why Author Would put story,1,1,1,21,55,9,6,4,0,0.25
9534,4,The author concludes story paragraph paragraph show connection nature girl The paragraph says snow melts geese return hibiscus budding I take test No NUM In spring events take place Spring sign life birth renewal The geese come back They renewed symbolic sense When snow melts see grass sign life When plants bud born The character decides nature symbolically reborn renewed start like nature,2,3,3,63,65,29,16,6,2,0.33
9535,4,concludes sTory paRagRaph wanted To say That going To Take The Test The winTeR CAPS show saeng vowed heRself By saying oR take The Test winTeR even CAPS Test passed winteR could passed duRing TheRe snow melted gRound,1,1,1,38,30,9,13,2,3,0.41
9536,4,In story author included concluding paragraph read rest story would know person talking comes back wanted take test would nicer weather first time took another reason I believe author added conclusion paragraph end novel show reader really understand novel really going novel So author first wanted make shore reader would understand ending book better conclusion paragraph end These reason I think author added concluding paragraph end novel,0,0,0,67,45,29,16,11,5,0.3
9537,4,Because wanted get done made end like first part story I like part birds came back got flower come back,0,0,0,20,70,8,6,1,3,0.29
