essays_id,essay_set,essay,rater1_domain1,rater2_domain1,domain1_score,word_count,reading_ease,nouns,verb,adjectives,adverbs,jaccard
15647,6,The builders architects faced several different obstacles dilemnas intefered construction Empire State Building One funds necessary order produce large structure They found constructing reconstructing frame structure time time feeble attempt reach desired perfection Another obstacle occurred entire concept shattered fact every dirigible intended land mast fueled helium The text reads Most digribles outside United States used hydrogen rather helium hydrogen highly flammable CAPS NUM This displays severity idea risks like could taken abandoned idea mooring mast,1,1,1,76,55,34,16,12,3,0.3
15648,6,In excerpt The Mooring Mast shows easy making dirigibles safe docking station A struggle faced time dirigibles countries made hydrogen highly flammable This meant exposed fire would instantly catch fire world populated city Another problem faced amount wind top Empire building With wind hard pilots dirigibles steer The wind would toss around pilots couldnt take hands geers These two many struggles pilots architects face docking dirigibles mast,2,2,2,67,55,30,15,6,3,0.29
15649,6,The builders Empire State building CAPS threw many obstacles They consulted experts taking tours equipment mooring operations U S Naval Air Station The builders also meet president formed airship transport company,1,1,1,31,65,15,7,5,1,0.28
15650,6,The builders Empire State Building faced obstacles dirigibles dock One obstacle example landing New York lacked suitable landing area dirigible Architects drop mooring mast top Empire State Building flat roof Also safety problem A German dirigible destroyed fire The owners Empire State Building realized accident could worse especially New York Even nature obstacle Winds constantly shifting top building So lead weights used dirigible safe dangling pedestrians There law airships fly low urban areas,3,2,3,73,65,31,14,17,6,0.27
15651,6,Based article The Mooring Mast written ORGANIZATION Empire State Building faced many obstacles There three main reasons CAPS S B used purpose constructed The point CAPS S B dirigibles stop refuel Dirigibles old word Blimps The obstacle CAPS S B come modifications nature law They pay MONEY modifications CAPS S B framework The second nature winds would make back Dirigibles move around wanted put weights back safe Last least law dirigibles cant low CAPS S B low cant fly low urban areas,3,3,3,82,70,36,20,13,6,0.4
15652,6,Based article The Mooring Mast ORGANIZATION builders Empire State Building faced many obstacles attempting allow dirigibles dock including overall structure building affeted stress dirigible safety issues impact nature To start dirigible weight plus wind pressure around building caused much stress building frame The steel frame building would strengthened modified order dirigible docked onto This modification strengthening building process would call investment sixty thousand dollars Next safety issue arose neglected building process began Most dirigibles used outside United States contained hydrogen highly flammable gas opposed using helium This serious problem German dirigible named Hindenburg destroyed fire New Jersey ORGANIZATION writes owners Empire State Building realized much worse accident could taken place densely populated area downtown New York ORGANIZATION NUM This major obstacle along wind factor The winds top building constantly shifting lead weights could placed dirigible stop shifting serious threat pedestrians In conclusion builders Empire State Building faced many obstacles prevented becoming big landing spot dirigibles,4,4,4,155,50,69,33,30,5,0.39
15653,6,While designing dirigible docked top Empire State building architects engineers encountered many obstacles Being immense project obstacles came naturally The first obstacle purely architectural A thousand foot dirigible moored top building would add stress building frame The architects would redesign building frame order building last The two obstacles clear start first nature The winds top building constantly shifting due violent air currents Now dock would hard reach extremely unsafe The last obstacle overcome architects engineers tried legally anyway existing law airships flying low urban areas would also restrict project actually stop alltogether Clearly large deciding factors overlooked designing moor ORGANIZATION competitive attitude made The Mooring Mast never destined fulfill purpose,3,3,3,110,45,40,23,22,12,0.34
15654,6,In excerpt The Mooring Mast ORGANIZATION building faced obstacles attempts allow dirigibles dock One obstacle would add stress building frame To accommodate stress sixty thousand dollars worth modifications strengthening would done Another obstacle dirigibles outside United States used hydrogen rather helium hydrogen flammable something like German Hindenburg destroyed fire happened New York consequences would much worse Also wind would obstacle well It would cause back ship swivel around mooring mast One overlooked obstacles law airships flying low urban areas illegal ship even tie building Clearly many obstacles place attempts allow dirigible dock Empire State Building,4,4,4,95,55,35,24,12,7,0.37
15655,6,The builders Empire State building face many obstacles attempting allow dirigibles dock One obstacle overcoming extra stress dock dirigible would add In excerpt The Mooring Mast author Marcia Amidon L sted states stress dirigibles load wind pressure would transmitted way buildings foundation Another obstacle builders faced violent weather top building L sted says Even dirigibles tethered mooring mast back ship would swivel around break mooring mast This problem would make unsafe passengers exit dirigibles walk gangplank connected Empire State building The wind also made difficult dirigible navigate mooring mast without blown buildings area One greatest obstacles making mooring mast safe L nden states dirigibles outside U S use hydrogn rather helium hydrogen highly flammable If dirigibles catch fire heavily populated area like New York casualties would numerous These many obstacles builders faced attempting construct mooring mast Empire State Building,4,4,4,139,55,64,29,19,6,0.29
15656,6,The builders empire state building faced alot trouble confusion attempt let allow dirigibles dock This never done CAPS didnt know expect except mooring mast At first Al smith builders thought amazing idea technology future things werent easy They faced complications ORGANIZATION research dirigibles It complicated process CAPS high air alot practicing involved Next alterations made building building wasnt strong enough hold dirigible CAPS make MONEY worth changes They finally realized unsafe idea wouldnt good highly flamable hielium CAPS back square Then government gave law said airships flying low urban areas wich would make illegal dirigibles tie empire state building And top floors turned soda fountain,3,3,3,105,65,44,27,15,7,0.4
15657,6,The builders Empire State Building faced many promblems attempting allow dirigibles dock Most problem encountered designing mast They found could drop mooring mast top building thousand feet The building strong enough strengthen building new steel frame Then builders also faced safety issues At thousand feet air currents extremely violant By end construction quickly noticed dirigibles could land Empire State Building,3,2,3,60,80,23,13,10,5,0.18
15658,6,The builders Empire State Building faced many problems prevented dirigibles landing It dangerous tether dirigibles mast building four main reasons The first dirigible moored mast building would add stress building frame This problem soon solved however steel frame changed became strong enough endure added stress Another reason dirigibles could attached Empire State building dirigibles highly flammable use hydrogen gas It became apparent dirigible catch fire downtown New York would terrible risk Dirigibles also attached mast winds top building would cause back ship swivel around around mooring mast would safe Finally dirigibles could moored Empire State building sharp spires buildings area could puncture dirigible shell The dirigibles could fly low without posing risk people Dirigibles could land Empire State Building many dangers,3,4,4,121,65,50,24,18,8,0.28
15659,6,The obstacles builders Empire State Building faced constructing correct mooring mast zepplins concerning safety people city They also account weather may affected blimps The builders add floors building strengthen base mast could work properly stay stable ruled using weights anchor blimps place people street Also chemicals blimp highly flamable put people around risk Sometimes winds strong blimps get close enough without punctured The builders faced impossible obstacles overcome,3,3,3,68,60,27,19,7,6,0.19
15660,6,Based excerpt obstacles builders Empire State Building faced attempting allow dirigibles dock huge challenge face For example mother nature one huge challenges would mostly face At top Empire State Building winds constantly shifting shifting due violent air currents As soon dirigible would hook building workers would find way keep airship crashing building rusty winds top building Therefore dirigible crashed anywhere ground would burst inferno inside dirigible filled hydrogen helium crashed involve heat fire would coming sparks prevents crashes ground,2,2,2,79,55,32,19,12,6,0.16
15661,6,The obstacles builders empire State Building faced lack suitable landing area They allow dirigibles anchor several hours refuel service let passengers Also Dirigibles docked means winch CAPS thats faced dock,1,0,1,30,65,15,6,5,2,0.26
15662,6,In ORGANIZATION many problems faced durring build The Way CAPS archetect Al Smith wanted make building like A building taller new chrysler building one futureistic The first problem ran building size going used There many differen ideas one came Al CAPS CAPS transportation This building could used new kind transportation people could board Dirigible also known blimp top building next problem would safe big problem middle New York The idea went Washington reviewed ended safe enough Al Smith care His building tallest,0,1,1,82,70,34,19,13,3,0.43
15663,6,The obstacles builders Empire State Building nature,1,1,1,7,65,5,1,0,0,0.3
15664,6,The builders Empire State Building faced several obstacles attempts allow dirigibles dock The first problem faced issue safety Most dirigibles fueled hydrogen highly flammable This danger shown Hindenburg disaster New Jersey owners building want face similar accident place densely populated New York Another obstacle arose fact violent wind altitude would toss back ship back forth This would technical hassle would also make nearly impossible get passengers dirigible make frightening experience anyone inside ship well In addition ships could weighed lead weights would risky dangling high pedestrians A final implication dirigibles moored Empire State building would violate existing law airships flying low urban areas Because docking ship would illegal obviously way helpful project In end obstacles key reasons endeavor failed,4,4,4,119,55,49,26,18,9,0.29
15665,6,The builders Empire State Building faced many obstacles attempting allow dirigibles dock One obstacles would modify entire building steel frame could withstand extra stress pressure dirigible moored top The steel frame Empire State Building would modified strengthened accommodate new situation Over sixty thousand dollars worth modifications made building framework Another obstacle builders Empire State Building faced dirigibles highly flammable filled hydrogen The owners realized may bad idea Hindenburg burst flames If happened Empire State Building would extremely drastic results When German dirigible Hindenburg destroyed fire The owners Empire State The building realized much worse accident could taken place densely populated area downtown New York The biggest obstacle though nature The winds top building constantly shifting due violent air currents The back ship would swivel around around mooring mast CAPS three obstacles builders Empire State Building faced trying allow dirigibles dock,4,3,4,140,50,58,26,25,5,0.34
15666,6,During construction mooring mast atop Empire State Building builders CAPS many challenges If put spire top building weight dirigible could destroy The construction team needed go back reinforce entire framework building obstacles way included low flying aircraft laws difficult weather conditions safety derigible crashed New York For reasons mooring mast doomed start,2,2,2,52,55,28,12,6,1,0.34
15667,6,In passage The Mooring Mast Marcia Amidon L sted talked obstacles facest trying allow dirigibles dock Empire State Building The three main obstacles safety mother nature existing laws One greatest obstacle safety L sted states Never fulfilled purpose The greatest reason one safety Most dirigibles outside United States used hydrogen rather helium hydrogen highly flammable Because hydrogen highly flammable would way would safe The building could catch fire danger Secondly nature would affect dirigibles L sted states The greatest obstacle successful use mooring mast nature The winds top building constantly shifting due violent air currents The violent air currents couldnt allow dirigibles Empire State Building dirigibles violent air currents It isnt safe Lastly laws obstacle builders face L sted knowledge The practical lesson dirigibles could moor Empire State Building existing law airships flying low urban areas The law huge obstacle builders building dirigibles Because build something law Because safety mother nature laws thats stop builders building dirigibles,3,3,3,157,60,74,26,25,10,0.27
15668,6,The CAPS builders Empire State Building faced attempting allow dirigibles dock high winds building struggled stay The builders difficulty getting building want They kept adding building making taller The dirigibles needed bigger could see The problem kept breaking something would go wrong They kept working building try get right continued fail They make plans realistic major problem,1,1,1,57,80,18,21,7,1,0.26
15669,6,Based excerpt obstacles builders Empire State Building faced letting things dock law air ships safety nature There law said air craft allowed fly low This law would make illegal ship ever tie building Also unsafe due hydrogen dirigibles Most dirigibles outside United States used hydrogen rather helium hydrogen highly flammable Nature factor high winds The winds top building constantly shifting due violent air currents Due obstacles engineers never thought Empire wtate building never became dirigible landing,3,3,3,76,60,34,13,16,9,0.23
15670,6,Builders Empire State Building faced many obstactles allowing drigibles dock One obstacle safety New York people They could used hydrogen dirigible could caught fire landed somewhere bad As said paragraph NUM The greatest obstacle succesful use mooring mast nature Winds top building constantly shifting violent air currents Even tethered mast back ship would swivel around mast Another law airships flying low urban areas The idea using mooring mast quietly disappeared,3,2,3,70,70,25,18,12,4,0.32
15671,6,The builders faced many obstacles trying add mooring mast top Empire State Building As stated paragraph fourteen nature biggest obstacle builders faced The violent air currents would cause dirigibles move around mooring mast even tethered Another obstacle faced architects add mooring mast top building sixty thousand dollars worth modifications made building framework Lastly stated paragraph thirteen dirigibles outside LOCATION used hydrogen rather helium even though flammable When German dirigible Hindenburg went flames owners building realized dangers,4,3,4,76,55,30,19,12,5,0.33
15672,6,The buiders faced many obstacles They could simply drop mooring mast top Empire State building flat surface took alot stress hard work The dirigible held single cable tether dirigible thousand feet That made builders stressed made think clearly carefully wind pressure also dirigibles load,1,2,2,44,70,16,10,8,4,0.2
15673,6,There problems dirigibles docking empire state Building One problem would foundation If dirigibles land building would cause tension buildings foundation CAPS squishing The architects would need made adjustments Foundation order dirigible land Another problem way ship would docked ship would docked would hazard would sway back forth around mast Either causing damage injury people New York,2,2,2,56,70,22,14,4,2,0.39
15674,6,There many obstacles faced trying allow dirigibles dock Empire State building One obstacles wind currents atop building They uncontrolable forceful unexpected In CAPS NUM explains U S Navy dirigible attempted dock could due winds U S Navy dirigible Los Angeles approached mooring mast could get close enough tie forceful winds L sted CAPS winds issue Another problem law airships flew low ground urban areas Not idea dangerous also illegal On May German dirigible called Hindenburg exploded Lakehurst New Jersey This due flammable hydrogen used lift dirigible Since dirigibles time obtained hydrogen another threat introduced This chance exploding trying dock Empire State Building If exploded numerous citizens many lives would CAPS The mooring mast idea non sense,4,3,4,116,65,45,22,26,7,0.37
15675,6,Dirigibles blimps hailed transportation future They top speed eighty miles per hour could cruise seventy miles per hour thousands miles without needing refueling One obstacle builders faced lack suitable landing area Al Smith spotted opportunity Empire State building He add mooring mast top building thus allowing dirigibles anchor several hours refueling service Also would let people The problem builders set mooring mast top Empire State building flat roof thousand foot dirigible moored top structure held single cable tether would add stress buildings frame,1,2,2,83,55,40,17,12,3,0.26
15676,6,In DATE Empire State Building constructed would used house new form travel The mooring mast constructed top building would used dock one thousand foot dirigibles future travel In theory blimp would docked mast using electric winch reality safe way high altitude Another challenge faced highly flammable gas hydrogen used One lit match could send steel frame plummeting earth The soft fabric covered steel frame could easily punctured unsuitable urban area The men constructing blimp either looked forgot elements nature restricted project At peak building winds reached high velocities shifted directions rapidly would rapped dirigible around mast The greatest obstacle law restricting airships flying low New York growing urban civilization In Empire State Building history one blimp attempted simulated dock another performed newspaper stunt Any man right mind would see project doomed begun,3,3,3,132,65,54,31,18,3,0.32
15677,6,The builders Empire State Building faced many obstacles attempting allow dirigibles dock They consulted experts taking tours equipment mooring operations New Jersey The architects drop mooring mast top building would add stress building frame The Stress load would transmitted way building foundation The steel frame would modified strengthened The greatest obstacle nature The winds top building constantly Shifting due violent air currents Even dirigible tethered mooring mast back ship would around around mooring mast You could weigh would dangling high pedestrians Street neither practical safe There also law airships flying low urban areas And When tried delivering newspapers noticed going work,3,3,3,101,65,38,24,16,4,0.25
15678,6,The builders face alot They rebuild whole top dirigibles could dock Architects couldent drop mooring mast top Empire State A Dirigible top building held single cable tether would add alot stress buildings frame The steel frame Empire State building would upgraded strengthened Also modifications would cost sixty thousand dollars make buildings framework better,2,1,2,53,70,21,11,9,2,0.22
15679,6,To building built Over NUM ft tall expect dirigibles blimbs able dock dangerous many obstacles around First weather always nice If windy day blimb going sway back forth thousands pedestrians New York Putting lead blocks back would dangerous lead back swaying thousands people underneath Secondly blimbs outside U S used hydrogen rather helium Hydrogen flammabe could destroy whole building fire spread Finally blimbs could moor Empire State building law airship hover low urban areas Those many reasons blimps could moor Empire State building,3,3,3,83,75,34,13,15,11,0.33
15680,6,The builders Empire State Building faced many problems attempting allow dirigibles dock A NUM foot dirigible would add stress buildings Frame Most dirigibles United States used hydrogen rather helium Hydrogen highly flammable The acciedent Hindenburg also raised alarm Hindenburg set fire Lakehurst New Jersey This showed builders much worse acciedent could happened densely populated area New York Another factor wind currents They constantly CAPS This would cause back Of dirigible sway move There also preexisting law stating airships could fly low urban areas These reasons obstacles builders fased attempting allow dirigibles dock Empire State Building,3,3,3,95,65,36,19,19,8,0.36
15681,6,Based excerpt many obstacles builders Empire State Building faced attempting allow dirigibles dock The first obstacle described paragraph NUM A thousand foot dirigible moored top building held single cable tether would stress building frame This means would need strength whole building If building would maybe fall The next obstacle described paragraph NUM The greatest obstacle successful use mooring mast nature This means wind strong would take land safely Also wind could cause dirigible fly away The CAPS obstacle described paragraph NUM The practical reason dirigibles could moor Empire State Building existing law airships flying low urban areas This means could target destroy building Another thing ever fell would kill lot people These obstacles builders Empire State Building faced attempting allow dirigibles dock overcome project cancelled,3,3,3,125,65,43,32,22,6,0.29
15682,6,There many obstacles builders faced order allow dirigibles dock atop Empire State Building One obstacle safety Foreign countries used highly flammable gases fill dirigibles According passage German dirigible Hindenburg destroyed fire Lakehurst New Jersey May owners Empire state building realized much worse accident could taken place densely populated area downtown New York Another obstacle whether The winds top building always shifting violent air currents For example U S Navy dirigible Los Angeles tie mast wind might resulted puncture shell dirigible One obstacle law banning airships flying low urban areas According passage This law would make illegal ever tie building even approach area Because many obstacles builders faced Empire State building unable fulfill original purpose still considered worldwide landmark today,3,4,4,119,60,51,22,25,8,0.36
15683,6,In article The Mooring Mast ORGANIZATION CAPS describes several problems builders Empire State Building faced trying allow dirigibles dock For example blimps dirigibles side United states used hydrogen rather helium Since hydrogen highly flammable since downtown New York populated anything go wrong could impact people New York resulting injuries well deaths Another reason existing law flying airships low urban areas This law making illegal ship even approach area Overall builders Empire State Building faced many obstacles could noticed building,3,3,3,79,45,35,17,13,5,0.39
15684,6,When building empire state Building workers faced problems One make CAPS architect building chrysler building raised total height making largest building world Al Smith former governor new york said going beat putting mooring mast dirigibles Another obstacle CAPS mast top frame It could dropped sixty thousand dollars worth maintenance done frame A third problem tying dirigibles violent winds could turn Blimp around possibly puncturing After Hindenburg atrocity people charge would let blimps dock Building fear endangering Public Thus mast never used,3,3,3,81,70,29,22,13,6,0.3
15685,6,People involved design construction Empire State Building faced major obstacles attempting transform idea docking dirigibles reality One biggest complications massive dirigible tied building cable tether stress would put building frame The builders architects find way allow stress travel foundation building They spent MONEY modifying framework From paragraph NUM In paragraph NUM read architects builders worked obstacle storage putting winches control machinery base shaft conical roof,2,2,2,65,50,36,14,8,1,0.33
15686,6,Although builders dream using Empire State Building dock dirigibles brilliant one builders came across many problems One problem law flying low urban areas like New York City Also nature played huge part plan didnt work The violent wind currents throughout city affected plan Most dirigibles landed open fields back end could weighted This would impossible docked building causing dirigible sway around possibly hitting buildings The builders take consideration densely populated New York City If anything ever happened docked dirigible like Hindenburg many people would affected This idea always stayed dream,2,3,3,90,60,33,19,15,7,0.32
15687,6,The obstical builder took Were difficult time CAPS In Way Such onley benefit Empire State building relly passed Was tallest building world They also attempted CAPS dirigible docking base future transportation CAPS filed CAPS certain law technicall difficulties CAPS obsticles adding extra body work building structure even neccarasary Those obsticle builder faced well CAPS time CAPS,1,1,1,56,50,26,10,12,4,0.26
