essays_id,essay_set,essay,rater1_domain1,rater2_domain1,domain1_score,word_count,reading_ease,nouns,verb,adjectives,adverbs,jaccard
15106,6,In excerpt The Mooring Mast Marcia Amidon L sted describes complicated obstacles builders Empire State Building faced attempting allow dirigibles dock One obstacles competition It planned world tallest building taller even new Chrysler Building CAPS Al Smith realized close losing title world tallest building CAPS NUM There competition tallest building Empire State Building Chrysler Building Another obstacle safety dirigibles German dirigible Hindenburg destroyed fire lakehurts New Jersey The owners Empire State Building realized much worse accident could taken place densely populate area town New York CAPS NUM The owner want risk accident cost people life would bad rep The obstacles builders went positive thing made CAPS open eyes,1,1,1,108,55,56,20,13,5,0.39
15107,6,There many obstacles faced letting dirigibles dock Empire State Building First greatest obstacle successful use mooring mast nature This means winds ontop building strong cause dirigible swivel around mooring mast tethered Also The practical reason dirigibles could moor Empire State Building existing law airships flying low urban areas This law would make illegal ship ever tie building even approach areas This shows waist time thinking ships could moor State Building clear law There still many obstacles come project,2,3,3,78,65,32,17,14,6,0.18
15108,6,Based excerpt The Mooring Mast three main obstacles prevented Mooring Mast Empire State Building used way intended The first obstical lacked safty Dirigibles highly flammable machiens used hydrogen fire New York City would tragic Another obstical Mooring Mast faced CAPS Nature The mooring designed attach dirigibles electric winch allowing dirigibles move freely When winds ORGANIZATION blow situation diridles would swivel around around mask CAPS NUM would cause tension build buildings frame lead unsafe inviorment The last reason law created stated illegal ship fly close urban areas safty reasons leaving whole Mooring Mast unusable,3,3,3,93,60,38,19,17,3,0.39
15109,6,Based excerpt obstacles builders faced attempting build dirigible dock Empire State Building finding way make building bigger Chrysler Building Designing mast CAPS reality Al Smith needed way make building bigger Chrysler building He came idea putting mooring mast building The idea seemed great While designing mast architects realized place mast right top building They modify foundation After changing skeleton building construction went planned Two month later mast finished architects forgot dirigibles use hydrogen highly flammable All work architects put nothing mooring mast never used,2,2,2,84,70,41,25,7,4,0.27
15110,6,There always challenges trying something inovative There obstacles like getting approval gaining support also need structurally sound Al Smith rest archetects faced During dirigibles supposed future travel Al Smith wanted able dock dirigible top Empire State building Other getting people go along plan problems The wind violent altitude Dirigibles supposed fly close city dangerous highly flamable In conclusion There many large obstacles overcome,2,2,2,63,75,23,12,14,7,0.26
15111,6,Based excerpt many obstacles builders Empire State building faced attempting allow dirigibles dock Hydrogen highly flammable The dirigibles ran hydrogen verses helium ever catch fire would pedestrians everywhere would grave danger The greatest obstacle successful use mooring mast nature Because dirigible would docked high little back control fierce winds would huge issue The winds top building constantly shifting due violent air currents If dirigible dock would also breaking laws existing law airships flying low urban areas The builders lot obstacles dealing docking dirigibles architectural,3,3,3,84,50,29,20,17,7,0.16
15112,6,The obstacles builders faced attempting allow dirigibles dock build higher taller building They also trouble building workers back dates Another obstacle trouble mast The mooring mast empire state building destined never fulfill purpose The workers also planning many obstacles wanted job,1,0,1,41,65,17,12,3,4,0.28
15113,6,The obstacles builders empire state face trying make sure building fall,0,0,0,11,75,6,2,2,0,0.3
15114,6,Some problems builders faced building mast top building builders drop mast top building flat roof wind would cause stress frame blimps could hanging The steel frame building would modified strengthened make mast The cost modifications another problem two,2,2,2,38,70,19,7,4,0,0.27
15115,6,The builders Empire State Building faced obstacles attempting allow dirigibles dock The main obstacle builders CAPS put mooring mast Empire State Building flat roof The mooring mast would put pressure building fram To overcome obstacle architects modify strengthen frame More sixty thousand dollars went modifications framework The greatest obstacle though nature nothing builders could The violent air currents caused winds top building constantly shift In open fields dirigibles could weighted back using led weights pedestrians around practical safe Without weighted dirigibles would swivel around,3,3,3,84,60,33,20,12,3,0.25
15116,6,In constructing Empire State Building builders faced multiple obstacles attempting allow dirigibles dock atop CAPS One obstacle constructors faced modifications The stress dirigibles load wind pressure would transmitted way foundation With obstacale contractors would need reinforce CAPS frame foundation And obstacle stated excerpt dirigibles outside United States use hydrogen rather helium flammable CAPS hydrogen flammable would good dirigible exploded streets New York Those obstacles contractors faced construction Empire State Building,3,2,3,70,45,34,12,12,2,0.33
15117,6,In excerpt builders Empire State Building faced many obstacles The reason builders faced obstacles architects could simply drop mooring mast top Empire State Building flat roof An example A thousand foot dirigible moored top building held single cable tether would add stress building frame The stress dirigible moor would make buildings frame bend become weak That one obstacle builders faced many,1,1,1,61,65,26,11,13,1,0.19
15118,6,The builders faced many obstacles building Empire State Building One obstacle Al Smith competition Chrysler building Which forty six feet taller Empire State Which led Smith making State Building reach height feet This leads another obstacle wanted add mooring mast top docking new airships This work due lack landing space A thousand foot dirigible moored top building held single cable tether would cause stress buildings frame In conclusion I explained obstacles Empire State Building,1,1,1,74,70,34,17,12,0,0.26
15119,6,While building Empire State Building architects faced many obsticles decision made use Empire State Building talk load refule dirigibles How dock dirigible side building one biggest concerns amount stress would cause even bigger worry But greatest obsticle project wind nature The fear wind would blow dirigible neighboring building tethering dirigible option safety reasons Due architect inability overcome obsticles Empire State Building never used original purpose,2,2,2,65,0,32,13,10,2,0.24
15120,6,The first obstacle expanded use New York City lake suitable landing area Because long one thousand feet length four blocks New York City The second dirigibles hydrogen hydrogen highly flammable And realized much worst accident could taken place New York located They think plan And another one winds top building constantly shifting due violent air currents,2,2,2,56,75,17,12,13,3,0.29
15121,6,Builders empire state building faced challenging obstacles attempt allow dirigibles dock The greatest obstacle nature This huge problem mooring masts could get close enough building land The winds strong Secondly existing law airships flying low urban areas meaning many people small area downtown New York dangerous dirigibles aircrafts low Lastly dirigibles outside state used hydrogen rather helium hydrogen highly flameable After German Hindenburg accident fire clear taking risk accident like happen heads thousands pedestrians bad idea The obstacles noticed late construction dirigables allowed land Empire State building day,3,4,4,88,50,38,14,21,7,0.28
15122,6,The obstacles needed overcame create idea docking platform top going announced The tallest building going tough The steps taken make idea come life began consulting experts They took tours equipment mooring operations ORGANIZATION New Jersey When time start constructing issue stress building would intake mass Dirigibles became problem They modified buildings frame accommodate new situation They also designed stainless steel tower stepped back design imitated overall shape building sixty thousand dollars worth modifications made achieve goal The Mooring Mast,2,3,3,79,55,33,23,11,2,0.43
15123,6,There many obstacles builders Empire State building faced attempting allow dirigibles dock One obstacle lot dirigibles outside LOCATION use hydrogen helium The problem hydrogen highly flammable German dirigible Hindenburg destroyed fire Lakehurst New Jersey May owners Empire State building realized much worse accident could taken place densley populated area downtown New York City CAPS imagine tragic chaotic would Another obstacle builders faced nature The winds top building constantly shifting violent air currents That would meant dirigibles could got swept back In conclusion several obstacles builders Empire State building faced attempting allow dirigibles dock,3,2,3,93,50,41,17,17,5,0.42
15124,6,In paragraph NUM states The mooring mast Empire State Building destined never fulfill purpose reasons apparent ever constructed These reasons one due flamable gases second due nature last already existing law As said paragraph NUM Most dirigibles outside united States used hydrogen rather helium CAPS Flammable hydrogen want highly populated area Paragraph NUM states The winds top building constantly shifting CAPS dirigible would stable enough Finally I said paragraph NUM There existing law airships flying low urban areas This law would make illegal ever tie building even approach area CAPS never chance dirigible able dock stated,3,3,3,96,20,37,19,18,13,0.29
15125,6,The builders Empire state building faced many obstacles attempting allow dirigibles dock The builders cautious safety played big role dirigibles Many dirigibles outside United States used hydrogen instead helium Because hydrogen highly flammable want city destroyed risk massive fire Another problem nature There violent air currents building danger local pedestrians New York The final obstacle builders faced trying pursue dirigible idea law prohibited airships flying low urban areas They would breaking law even allow within area building many issues occurring development dirigible plan idea using quietly disappeared,3,3,3,87,60,37,19,17,4,0.28
15126,6,Some obstacles builders Empire State Building faced build morring mast atach mooring mast frame Empire CAPS Building,1,1,1,17,65,10,4,2,0,0.31
15127,6,In excerpt The Mooring Mast builders Empire State Building face obstacles attempting allow dirigible dock The main obstacle lack suitable landing area Dirigibles need large area land Al Smith said add mooring mast top building would allowed dirigible land several hours During time land dirigible may get refueling service let passengers Passengers could get dirigible safely walking gangplank open platform Architects trouble putting mooring mast top Empire State Building flat roof afraid load dirigible wind pressure would transmitted Dirigibles trouble saftly dirigibles use hydroge instead helium hydrogen highly flammable The greatest obstacle mooring mast nature wind high due violent air currents would safe dirigibles The practical reason dirigibles allow moor ORGANIZATION law agaist airship flying low The idea dirigible given away airplanes The obstacles builders ORGANIZATION faced attempting allow dirigibles dock solved,3,4,4,132,60,54,29,28,5,0.33
15128,6,Based excerpt workers faced lot obstacles attempting allow dirigibles dock In paragraph NUM architects say could simply drop mooring mast top Empire State building The reason top roof held together one cable tether The effect landing something heavy roof would add stress buildings frame In order allow dirigibles would need strengthen modifi buildings framework would cost least MONEY Rather architects designed glass chrome stainless steel tower CAPS inside This would rise conical roof would house mooring arm paragraph NUM Elevators would also inside help passengers board dirigibles,3,2,3,87,65,41,17,10,4,0.33
15129,6,The builders Empire State building faced many obstacles building One obstacle hit dirigibles couldnt dock mooring mast When architects engineers built building put flat roof Mooring Mast could placed They said frame Empire State building would modified strengthened fix situation Another obstacle couldnt Rope holding Mooring Mast dirigibles wouldnt hold Those obstacles architechs went threw,2,1,2,55,60,25,18,4,0,0.29
15130,6,Some obstacles builders Empire State Building faced attempting allow dirigible dock winds height alway changing difficult land dirigible Also dirigible highly flammable used hydrogen rather helium The winds top building constantly shifting due violent air currents The project bad idea start The practical reason dirigibles could moor Empire State Building existing law airships flying low urban areas They even attempt try gave In December ORGANIZATION dirigible Los Angeles approached mooring mast get close enough tie forceful winds It made job work,3,2,3,81,40,32,18,16,7,0.33
15131,6,The obstacles faced builders Empire State Building attempting dirigibles dock many predicte The obstacles faced dirigibles dock many variables climite Buildings dirigibles selfs The climite said paragraph NUM consisted dangerouse uncontraiable winds reason Empire State building The urban areas around consited sharp hull breaching spires due winds made hull breach NUM times likely Finaly constrousion Dirigibles made steel fram wrapped cotton filled hydrogen make lighter unfortuntly hydrogen highly flamable,2,2,2,69,45,31,17,12,4,0.26
15132,6,In order let dirigibles dock Empire State Building many changes made The builders planners faced many obstacles First even consider idea consult experts meant taking tours research They find safe way mooring airships mast The next obstacle paragraph NUM Docking dirigible building would put stress building frame The builders modify strengthen frame One last obstacles face designing tower The builders eventually decided rocket shaped mast four wings corners house mooring arm They house machinery winch derigible Overall builders make drastic changes spend lot money something even safe end,3,3,3,88,80,43,18,11,5,0.27
15133,6,While constructing top Empire State Building builders faced many obstacles According excerpt architects drop mooring mast top Empire State Building roof Also thousand foot dirigible top building held single cable would add much stress frame The building In order maintain dirigible place would cost money Quoating article The stress The The The dirigibles load wind pressure would transmitted way building foundation Empire State Building would modified strengthened sixty thousand dollars worth modifications The technical financial issues made difficult architects build mooring mast top Empire State Building,2,2,2,86,55,39,16,16,1,0.26
15134,6,The builders faced problem letting dock One problem Most dirigibles outside United States use hydrogen rather helium hydrogen highly flammable said page NUM The lead weights lower dirigibles could also set risk people said page NUM,2,2,2,36,65,17,6,4,5,0.32
15135,6,In excerpt The Mooring Mast Marcia Amidon L sted builders Empire State Building faced many obstacles attempt allow dirigibles dock The architects acomidate lot thing allow dirigibles dock The mooring mast For example In CAPS NUM says The steelframe Empire State Building would modify strengthen accommodate new situation Also CAPS NUM says The greatest obstacle successful use mooring mast natur The winds top building constantly shifting due violent air currents These factores many reason mooring mast never poot use feer safty law,2,3,3,82,65,38,15,12,3,0.31
15136,6,In excerpt The Mooring Mast Marcia Amidon L sted many obstacles builders faced attempting allow dirigibles dock One reason safety Paragraph NUM excerpts explains Most dirigibles outside United States used hydrogen rather helium hydrogen highly flammable It shows us accident happen mast densely populated area like downtown New York accident could get ugly Another reason nature Paragraph NUM explains winds top building constantly shifting due violent air currents This another safety issue dirigibles would dangling high pedestrians street A third obstacle existing law airships flying low urban areas As see obstacles builders faced,3,3,3,93,60,38,18,17,6,0.36
15137,6,The builders Empire State Building faced obstacles attempting allow dirigibles dock An obstacle dealt dirigibles fit dock Empire State Building Another obstacle dealt mast These obstacles made construction failure author says The mooring mast Empire State Building destined never fulfill purpose reasons apparent ever constructed CAPS thirteen First CAPS five states dirigibles actually enormous steel framed balloons envelopes cotton fabric filled hydrogen helium make lighter air CAPS six states Some long one thousand feet CAPS may blimp size ever managed land Empire State Building Also CAPS nine says A thousand foot dirigible moored top building held single cable tether would add stress building frame This CAPS also states The stress dirigibles load wind pressure would transmitted way building foundation nearly eleven hundred feet These obstacles builders face The fate mast CAPS NUM says neither practical safe The architects blind potential problems mast In end mast great attempt indeed failure,1,2,2,149,55,65,33,19,10,0.31
15138,6,The architect new building three large problems allowing dirigibles moor top The first problem harsh wind high made extremely difficult dock dirigible Fearing wind would blow Dirigible onto sharp spires buildings area would puncture dirigible shell captain could even take hands levers Second The back dirigible would tied This problem would lead safety hazards people getting The winds top building constantly shifting due violent air currents Even dirigible tethered mooring mast back ship would swivel around around mooring mast This effect would also make challenging dangerous take The last reason would illegal fly aircraft sso low city already eliminating possibility allowing dirigibles moor top Overall idea thought well hurried would first building world dirigible mooring mast,3,3,3,116,60,40,24,20,12,0.24
15139,6,In excerpt The Mooring Mast Marcia Amidon L sted builders faced many obstacles attempting build Empire State Building use dirigibles dock One obstacle architects engineers faced dirigibles outside United States used hydrogen rather helium NUM dangerous hydrogen highly flammable Another obstacle faced winds top building constantly shifting due violent air currents NUM even though dirigible would tied mooring mast back ship would swivel around around mooring mast NUM Another problem due winds would wind would blow dirigible onto sharp spires buildings area would puncture dirigible shell NUM A last example obstacle would law stating airships flying low urban areas NUM illegal Even law making illegal ship ever tie building even approach area NUM attemption even trying would dangerous people around building,4,3,4,121,30,45,25,21,10,0.27
15140,6,The obstacles CAPS Empire State Building faced attempting allow dirigibles dock safety people Also As says CAPS NUM existing law airships flying low urban areas Another main reason CAPS NUM The wind currents violently shifting,2,2,2,35,55,15,8,4,2,0.25
15141,6,The obsticles The empire state building The baloons made flammable material The wind blowing The dirigible around,1,1,1,17,50,6,3,2,0,0.33
15142,6,There many obstacles builders Empire State Building faced attempting allow dirigibles dock excerpt The Mooring Mask PERSON The architects engineers Empire State Building competitive Building tall great plan used They wanted building great top wanted also useful wanted dirigibles dock They figured good idea looked history many accidents happened If accident happened New York like would big deal many people live The winds top building constantly shifting due violent air currents The back ship would swivel around around mooring mask They felt would unsafe many reasons This reason builders went many obstacles,2,2,2,92,70,33,24,17,3,0.27
15143,6,Acording CAPS CAPS architects came across several obsticles came building Area Where Blimps could land made CAPS unfesable One CAPS Reasons CAPS CAPS due Air laws made illegal fly low urban Areas An additional conflict fact CAPS winds could push tale blimp sharp spires neighboring buildings would pop dirigible balloon,2,2,2,50,55,22,10,11,0,0.31
15144,6,In excerpt The Mooring Mast I seen builders empire State building ran obstacles trying allow dirigibles dock The empire State building already standing architects decided renovate make dock dirigibles The architects working project strengthen buildings frame They also wenches control machinery dirigible mooring The architects also needed install housed elevators stairs bring passengers base floor back After renovations done empire state building floors After building done owners found could let dirigibles building They would break law airships flying low urban areas So empire state building finished could use dirigible,3,2,3,89,60,36,26,9,5,0.26
15145,6,Al Smith announced Empire State Building would reach new height ft December His plan build mooring mast top building make equiped modern travel The bulders faced three main obstacles trying allow dirigibles dock The first obstacle safety Most dirigibles outside LOCATION used hydrogen highly flamable When Hindenburg destroyed fire owners Empire State Building became worried much worse accident would occur New York The second greatest obstacle nature The winds top building constantly shifted would cause back dirigible swivel around mast The way solve problem lead weights This practical safe The final obstacle law airships flying low urban areas This made illegal dirigibles tie building In conclusion three main obstacles builders faced safety nature law,3,3,3,114,65,48,22,21,4,0.38
15146,6,The obstacles builders Empire State Building faced attempting allow dirigibles dock lot room land The length four blocks New York City They also needed consult experts take tours equipment They lots experiments tests dirigibles It also dangerous land It also bad enviroment hydrogen used highly flammable Dirigibles dock stable makes safe people,2,3,3,52,70,23,11,7,4,0.25
15147,6,The builders Empire State Building faced many obstacles attempting allow dirigibles dock One obstacle getting mooring mast top building The architects could simply drop mooring mast top Empire State building flat roof A thousand foot dirigible mounted top building would add stress building frame The architects solve problem modifying building framework Another problem wind The winds top building constantly shifting due violent air currents CAPS one wire connected front dirigible would go round round due back exposed winds This problem never fixed The builders Empire State Building faced many obstacles overcome rest resulting ultimate failure mooring mast,3,2,3,97,65,39,22,18,4,0.21
15148,6,Al Smith great idea When thought going dirigible station dock top world tallest building He great creativity wanted use building full potential Although many problems idea One urban area many people lived downtown New York City would law zeppelins flying populated area Another important problem intense winds harsh made hard dock building There many obstacles way fulfilling Al Smith dream Empire State Building dock dirigibles top building,2,2,2,67,75,34,8,18,1,0.32
15149,6,Some things faced safety hazards Like said CAPS NUM Hindenburg destroyed said The owners empire state building realized much worse accident could new york Another obstacle faced said CAPS NUM Nature The winds would make airship CAPS around like crazy The last problem law stating airships CAPS low urban cities,2,2,2,50,80,20,12,7,1,0.41
15150,6,In DATE dirigibles considered transportation future Trying make New York forefront modern travel architects builders Empire State building rushed challenge building mooring mast failling recognize obstacles lay ahead As architects designed mast quickly realized frame building equipped handle weight top flat roof Making adjustments cost builders time New York City money In addition workers considered wind currents In excerpt writer says U S Navy dirigible Los Angeles approached mooring mast could get close enough tie forceful winds CAPS workers considered possible obstacles building something big project mooring mast,3,2,3,88,65,41,21,17,4,0.4
