essays_id,essay_set,essay,rater1_domain1,rater2_domain1,domain1_score,word_count,reading_ease,nouns,verb,adjectives,adverbs,jaccard
14834,6,There many obstacles builders faced attempting dirigibles dock Empire State Building Safety issue dirigibles highly flammable gas hydrogen So dirigibles explode New York many people could killed populated Another problem keeping derigible CAPS people get wind moves back end The way tie lead weights back dirigible would dangerous people So obstacles workers faced never got past made world highest soda fountain tea garden tourists observation area,2,2,2,66,55,29,13,12,6,0.23
14835,6,Him start would many problems allowing dirigibles dock NUM feet air The major problem would Empire State building constructed New York City highly populated area Below mooring mast would several buildings people worked lived If something happened dirigible attempting dock could take building lives people Not city streets pedestrians walked In paragraphs NUM passage also talks stress heavy steel framed airship mooring top building The frame would need dense architects project discovered expensive Other safety issues include high winds would drift dirigibles course safety dirigibles The passage mentions Hindenburg incident well worry owners building happening densely populated area,3,3,3,98,65,37,25,16,6,0.31
14836,6,The builders Empire State Building faced many obstacles attempting allow dirigibles dock one obstacle dirigible would held single cable tether This would add stress building frame order make frame sturdy modifications building framework cost sixty thousand dollars Another obstacle builders faced dirigible use hydrogen highly flammable Since New York densely populated area would work well The dirigibles would also weighted back lead weights In order lead weights would end dangling high pedestrians street safety issue one last obstacle builders faced law airships flying low urban areas This law made illegal ship ever tie building approach area,3,4,4,96,60,42,19,14,6,0.21
14837,6,In passage The Mooring Mast Marcia Amidon CAPS The builders Empire State Building faced opstacles building Empire State Building allowing dirigibles dock One reason Al Smith four term governor New York headed efforts construct Empire State Building years office made tower tall The hight building ft But almost losing title worlds tallest tower announced would top hat put tower Another reason tower made Dirigibles blimps That Could CAPS people New York New Jersey Smith wanted place dirigibles could dock But never happened German dirigible Hindenburg destroyed fire Lakehurst New Jersey May owners State building realized much worse accident could New York In idea dropped another dirigible trying proform stunt The Empire State Building never got fofil made,1,1,1,117,60,56,25,13,4,0.41
14838,6,The builders Empire State Building faced many obstacles attempting allow dirigibles dock The first obstacle faced existing law airships flying low urban areas This made illegal dirigible tie building Another obstacle faced allowing dirigibles dock safety Most dirigibles used hydrogen highly flammable If dirigible caught fire densely populated area New York would good chance many people would hurt A final obstacle faced nature The winds top Empire State building constantly shifting due violent air currents Even though dirigible would attached mooring mast back would move around mooring mast dangerous way Many obstacles faced workers Empire State Building order allow dirigible dock,3,3,3,101,60,35,23,21,7,0.23
14839,6,soon conception The Empire State Building mooring mast doomed fail Early obstacles easily surmounted example problem added stress building frame caused added weight moored airship This fixed structural modifications building frame expensive fairly simple procedure one biggest blows project advent Hindenburg disaster The Hindenburg disaster cause forefront decline airships Airplanes became safer faster designer form transportation In addition Hindenburg disaster soon became clear mooring airship NUM higher feasible Surging winds would allow airship maintain course ship would blown erratically around mast The final nail coffin mooring mast law prohibiting airship travel urban areas These multiple factors easily disallowed possibility successful airship travel future,4,3,4,103,50,49,16,20,7,0.3
14840,6,The builders Empire CAPS Building faced obstacles attempting allow derigibles dock The architects realized could put mooring mast top building without modifying strengthening steel frame building The stress dirigible load wind pressure would add much weight framework could cause collapse They strengthened framework bottom building top putting shiny glass chrome nickel stainless steel tower top building The builders faced obstacles successful completing goal The mooring mast used docking station still looked final peice makes Empire State Building stand buildings downtown New York City,2,3,3,83,60,37,23,11,2,0.31
14841,6,In excerpt The Mooring Mast Marcia Amidon L sted many complications occurred plans construction attempted docking mast One obstacle dirigibles heavy metal frame building would modified After repairing framework Empire State Building two trial runs displayed ORGANIZATION dirigible Los Angeles Goodyear blimp Columbia The result expirament wind current physically allow blimp come close enough building dock Also existing law airships flying low urban cities obstacle could surpass Within years postponing efforts airplanes made way dirigibles transportation long forgotten,3,3,3,78,45,39,15,8,5,0.34
14842,6,The obstacles builders face great They explained dirigibles outside LOCATION use different gas called hydrogen highly flammable Following told LOCATION Hindenburg fire used hydrogen They realized happen urban area could worse Anthore obstacle faced wind If dirigible parked mooring mast violent wind speeds would make Blimp shift cause strees building steel frame The greatest obstacle law passed The law stated airships could fly low urban areas This would keep blimps landing,3,3,3,71,75,25,18,13,2,0.36
14843,6,The builders Empire State Building great idea They wanted able tethered dirigibles blimps top building However many problems idea First blimps sturdy Strong winds could easily blow dirigibles trying dock spires buildings Dirigibles also started use hydrogen gas rather Helium Hydrogen gas extremely flammable The smallest sparking could set whole blimp ablaze The docking system self also problem The way keep dirigible level hang lead weights side One concern way could fall fall densely populated city This could proved disastrous,3,3,3,80,75,33,13,14,8,0.23
14844,6,The Empire State Building docking zone magnificent novel idea first concieved difficult implement Al Smith spearheaded operation anxious complete Since enough time devoted researching risk structure dock plan mount top Empire State Building already failure Before construction even began trouble started brew The building withstand stress DATE foot long dirigible The shock building would transmitted tremendous pressure foundation So roof would done order structurally sound After many months NUM dollars creation landing dock could begin Life precious landing dock volatile dangerous used The architects overlooked fact foreign ones made hydrogen helium Hydrogen extremely Flammable In LOCATION Hindenburg constructed using hydrogen caught aflame killed hundreds There even law stating aircraft could suspended close urban area The idea ostentatious showy rushed precautions taken account The obstacles faced docking station much finally plan erect abandoned,3,3,3,132,60,53,32,19,11,0.36
14845,6,During construction Empire State Building allow dirigibles dock constant obstacles faced builders Architects could place mooring mast top Empire State building NUM ft dirigibles would add stress buildings framework therefore causing architects modify framework This would cost extra MONEY modifications The Architects know modifications help Safety another concern Foreign dirigibles used hydrogen rather helium highly flammable For example When German dirigible Hindenburg destroyed fire Lakehurst New Jersey May owners Empire State Building realized much worse accident could taken place densely populated area downtown New York The Architects also worry ORGANIZATION constant shifting winds due violent air currents Even dirigible tethered mooring mast back ship swivel around around mooring mast CAPS dirigibles land open fields weighed drift away except impossible weigh dirigible air They dangle high pedestrians walking around streets therefore making safe There also law airships flying low urban areas This law would make illegal ship ever tie building even approach area There two attempts dock building NUM December ORGANIZATION dirigible Los Angeles Attempted dock except get close enough high velocity winds By late idea using mooring mast dirigibles passengers quietly disappeared Airplanes became future,4,4,4,185,50,76,36,33,19,0.46
14846,6,The builders Empire State Building faced many obstacles trying construct marvelous building One obstacle making sure stress building dirigible would go foundation building top middle could cause collapse As said text The steel frame Empire State Building would modified strengthened accommodate new situation Over MONEY worth modifications made building framework CAPS building changed many ways make stable enough dirigible dock Another obstacle weather building strong winds air currents This would mean dirigible would dangling high pedestrians street safe thing highly flammable hydrogen floating around millions An obstacle well came dirigibles time effort put learn safely install mooring mast This took people going professionals like Navy finding proper way The mooring mast Empire State Building caused many obstacles get way,4,4,4,119,55,52,25,19,6,0.27
14847,6,The builders Empire State Building faced many obstacles attempts allow dirigibles dock mooring mast Al Smith architect man behind idea Empire State building He maker Chrysler building competing eachother construct world tallest building To make Empire State building bigger Chrysler building Smith going construct somthing John Tauranac stated Would equipped age transportation dream aviation pioneers That dream travel blimp The Empire State Building going mooring mast top dock air ships It going easy concept The architects drop mooring mass roof would stress buildings frame The greatest reason mast would never fufill destiny safety The excerpt states Most derigibles used hydrogen Hydrogen flammable There also law air ships flying low urban areas After numberous attempts modifications idea shelved,2,3,3,117,70,62,24,12,3,0.29
14848,6,The obstacles builders Empire state Building faced attempting allow dirigibles dock lack suitable landing area A mooring mast added top building would dirigible anchor several hours refueling service let passengers electric winch hauled line front ship tied mast The body dirigible could swing breeze get passengers could safely get The dirigible walking gang CAPS open observation platform They Empire state Building consulted experts taking tours equipment mooring operations U S Naval Air station Lakehurst New Jersey,2,1,2,76,60,34,18,13,2,0.31
14849,6,The CAPS The Mooring Mast Marcia Amidon L sted shows thoughtful intelligent yet obstacled ideas attaching landing dock Empire State building The obstacles builders Empire State building overcome wind speeds dirigibles would land strong would whip balloon around like rag doll They would use lead weights would pose another problem questioning foundation building The weight building also weight lead weights might collapse structure The gases use hydrogen hellium make balloon fly hydrogen highly flamable used populated areas There existing law airships flying low urban areas CAPS obstacles reason mooring mast The Empire State building destined never fullfill purpose,3,3,3,98,60,42,26,10,5,0.28
14850,6,In Marcia Amidon L sted excerpt The Mooring Mast many obstacles engineers Empire state building looking new way dock dirigibles One obstacle face steel work building The pressure wind dirigibles load cost company MONEY Secondly design special floors passengers dirigibles One floor would baggage suitcases special observation deck set passengers exit enter ship Lastly building would floors would need durable special materials needed brought used create building All Empire State Building engineers overcome many obstacles constructing ft building,1,1,1,78,55,37,19,9,3,0.27
14851,6,The builders empire state buildings many problems allowing dirigibles dock Things wind actual docking people getting safely The actual docking impractical would nearly impossible connect winch The wind main reason fate mast First wind current strong pilot would difficult time getting close enough The captain Navy dirigible Los Angeles approached mooring mast could get close enough tie forceful winds Also even could tie back dirigible would swing around fiercefuly So builders dealing impractical task,2,3,3,74,70,25,13,15,10,0.29
14852,6,The first obstacle faced reconstruct body frame could support mooring mast The second dirigibles country used hydrogen wich highly flammable instead helium The third reason wich apparent start law airships flying low urban areas The last reason wind conditions hight made impossible dirigibles land without tail swaying wind,3,2,3,48,55,18,8,11,3,0.3
14853,6,The obstacles builders Empire State Building faced attempting allow dirigibles dock stress building frame The stress dirigible load wind pressure would transmitted way building foundation nearly eleven hundred feet The steel frame Empire State Building would modified strengthened accommodate new situation Over sixty thousand dollars worth modifications made building framework,2,2,2,50,55,25,8,8,2,0.13
14854,6,The builders Empire State Building faced many obstacles attempt allow dirigibles dock One major obstacle constructing mooring mast would threaten buildings structure The builders modify strengthen frame Empire State Building According excerpt sixty thousand dollars worth modifications made framework Another big obstacle safety At Empire State Building hight would illegal land dirigible The dirigibles time filled hydrogen If dirigible ever exploded would threaten hundreds pedestrians streets New York City,3,3,3,69,65,32,16,9,1,0.27
14855,6,The builders ORGANIZATION many obstacles attempting allow dirigibles dock The stress dirigible load wind pressure would transmitted way building Foundation nearly eleven hundred Feet The winds current would cause dirigible drag building wind current strong The weight dirigible pressure wind may cause building collapse Al Smith realized close losing title world tallest building December announced Empire State Building would reach height Feet Al Smith want lose title decides make building taller The taller building gets stronger wind current adds building Dirigibles moored open landing fields could weighted back lead weights using Empire State Building would dangling high pedestrians street neither practical safe Dirigibles land wide open areas anything harm blimp citizens passengers The gases used CAPS dirigible make lighter air highly Flammable These obstacles builders Empire State building CAPS,3,4,4,129,60,62,25,23,5,0.38
14856,6,In reading The Mooring Mast written Marcia Amidon L sted builders Empire State Building faced obstacle Which attempting allow Dirigibles dock Not mention Dirigibles thought transportation future First The one obstacle expanded use New York City lack suitable landing area NUM This quote shows one Dirigible would need find proper landing area As well able fit Thus need area space Also long one thousand feet length four blocks New York City NUM It seems though enough space due Dirigible long It also shows would architects come plan making work way would fit properly Therefore obstacle builders Empire State Building faced Which lack suitable area,2,1,2,104,80,39,24,15,10,0.38
14857,6,The builders Empire State Building faced difficult circumstances many obstacles task designing brand new Empire State Building accompany new means travel The builder mission design top Empire State Building accommodate mooring blimps one thousand feet air The first obstacle designing landing area This difficult architecture needed never created even attempted past A second obstacle make sure Empire State Building could withstand stress created blimp Paragraph NUM says The stress dirigibles load wind pressure would transmitted way building foundation The difficulty obstacle refurbish steel frame Empire State Building took lots time work sixty thousand dollars The greatest obstacles successful mooring nature There violent wind currents top building blimps never stable There many pedestrians moored dirigible dangerous obstacle Lastly pre existing laws airships flying low urban areas posed new problem even successful architecture laws disallowed blimps first place Planes also becoming popular,4,4,4,140,55,62,28,25,10,0.25
14858,6,In building Empire State Building builders faced problems allowing dirigibles dock Some obstacles builder faced actually way dirigibles dock feet ground The strong air currents changing wind direction also made difficult piolots steer dirigibles close enough mast docking A final problem builders faced law airships flying low urban areas NUM Which basically means docked Empire State building would low urban aera law,2,3,3,62,60,28,16,8,4,0.31
14859,6,The idea mooring dirigibles top building stood feet streets downtown New York facinating amazing idea An idea would bring New York whole age transportation NUM Unfortunately wonderful idea holes plans Later architects building mooring mast discovered idea going fulfill The idea many obstacles overcome The fact dirigibles outside U S used hydrogen rather helium hydrogen highly flammable NUM If anything go wrong would catostrophic seeing highly populated streets Also greatest obstacle nature NUM There much wind keep aircraft steady undercontrol The reality fact idea moor derigibles sounded great far many risks carry plan,2,4,2,93,70,42,19,13,9,0.37
14860,6,In excerpt The Mooring CAPS Marcia Amidon CAPS builders empire State Building faced obstacles attempting allow dirigibles dock The Empire State Building destined never fulfill purpose due many reasons many obstacles One many reason dirigibles outside United States used hydrogen rather helium hydrogen highly flammable Furthermore biggest obstacle sucessful use morning mast nature Due reason winds top building constantly shifting due violent air currents Even dirigible tethered mooring mast back ship would swivel around around mooring mast Using Empire State Building would dangling high pedestrians Street neither practical safe The obstacles existing law airships flying low urban areas This law would make illegal ship ever tie building even approach area although two dirigibles attempt reach building entire idea dropped The builders Empire State Building faced many hard obstacles,3,3,3,128,55,49,27,26,9,0.31
14861,6,The builders Empire State Building face many obstacles attempting allow dirigibles dock One obstacle faced safety issue As stated paragraph NUM foreign dirigibles used flammable element hydrogen rather helium A fire would deadly highly populated area like downtown New York Another obstacle builders faced wind In paragraph NUM says The winds top building constantly shifting due violent air currents This would cause un tied back dirigible thrash around even swivel around mooring mast When dirigible moored open fields weighted lead weights Doing open air Empire State building would un safe due pedestrians The final obstacle builders faced law airships flying low urban areas In paragraph NUM says This law would make illegal ship ever tie building even approach area This mooring mast dirigibles Empire State building never served purpose,3,3,3,129,70,48,27,24,10,0.33
14862,6,Based excerpt The Mooring Mast Marcia Amidon L sted many obstacles builders Empire State Building faced allowing diriibles land One obstacles safety problems The drigibles come close enough Empire State building could able tie dirible This put diribles close people There law stated airships fly low urban areas There disaster happened Lakehurst New Jersey trying prevent happening New York paragraph NUM Another problem builders faced strong winds nature allow diribles get close enough tie mast There many obstacles builders face end worth making Empire state building dirible dock,3,3,3,88,75,38,20,16,7,0.29
14863,6,The builders Empire State Building faced many obstacles attempting allow dirigibles dock The steel frame Building needed modified strengthened make place dirigibles dock Also sixty thousand dollars worth modifications made The last obstacle builders thousand foot dirigible moored top building would add stress buildings frame It easy builders build mooring mast top highest building one thousand two hundred fifty feet architects reached point designing mooring mast,2,3,3,66,65,24,20,12,1,0.19
14864,6,While building Empire State Building workers faced many obstactles attempting dirigibles dock A dirigible attached mast building would add extra stress builders instead sixty thousand dollars worth reconstructions fix buldings framework Dirigibles also dock line running front ship mast planned blimp able sway wind unrealistic ship could attach building high winds Other obstacles faced letting dirigibles dock building safety hazards hydrogen used dirigibles outside U S highly flammable Builders also take consideration pre existing law airships flying low urbanized areas illegal dirigible tie building The task dirigibles attach Empire State building impossible task begin,3,4,4,94,45,42,23,16,5,0.28
14865,6,There many reasons architects problems allowing dirigibles dock empire State building One problems dirigibles NUM ft long would much There Would single cable tether would add stress buildings frame The entire Steel frame would modified strengthened would cost sixty thousand dollars The greatest reason mooring mast would never fullfill purpose safety Most dirigibles United States used hydrogen rather helium hydrogen highly flammable The greatest obsticale successful use mooring nature The winds top buildings constantly shifting due violent air currents Even dirigible tethered mooring mast back Ship would swivel around They meant land open playing feilds using empire state building Where would dangling high pedestrians safe,3,3,3,105,65,37,19,21,10,0.26
14866,6,obstacles builders went threw using hydrogen flammable Another one wind top building constintly shifting due violent air currents third one back ship would swivel around around mooring mast last least law airships flying low urban areas,2,2,2,36,60,13,7,8,1,0.23
14867,6,There many obstacles builders face attempting allow dirigibles dock One obstacle wind At higher elevation wind much powerful This would make difficult accually get dirigible close mast Also structure Empire State Building The framework built amount weight would top building Builders made MONEY worth fortifying framework Those obstacles builders face attempting allow dirigibles dock Empire State Building,2,2,2,57,70,24,12,9,3,0.26
14868,6,The builders Empire State Building faced many obstacles attempting allow dirigibles dock Although builders thought brilliant idea carefully consider safety hazards may encountered unrealistic idea truly One greatest reasons mooring mast destined unable fulfill purpose safety concerns In paragraph NUM states Most dirigibles outside United States used hydrogen hydrogen highly flammable When dirigible destroyed fire New Jersey owners Empire State building realized much worse accident like would occurred place densely populated downtown New York Another practical reason dirigibles could moor top building stated paragraph NUM existing law airships flying low urban areas That would make impossible dirigible even approach area let alone able tie building It apparent builders Empire State Building faced many issues attempt,3,2,3,115,50,42,29,23,8,0.33
14869,6,The builders Empire State building seem blind dangers would result mooring mast One huge factor danger violent winds elevation The blimp would swung around tether going building could either damage building damage blimp Alsoif blimp moving would passangers get They could fall loading dock whether going blimp Passengers could even get blown open floor Empire State building Another factor high population New York City something like debris fallen streets could probably kill walking pedestrians I would think architects would considered factors trying begin project,2,2,2,84,65,31,21,8,5,0.34
14870,6,In excerpt Mooring Mast Marcia Amidon L sted construction Empire State Building faces many problems One problems governer New York Al Smith wanted building tallest world In order would need mask break record The mask made made nature danger whole building violent air current Another reason Empire State Building failed law banning airships flying low urban areas This law went effect German dirigible caught fire Lakehurst New Jersey Those many problems dirigibles faced passing Empire State Building,2,2,2,77,65,42,13,14,0,0.31
